most_similar_channel,reference_link,title,story_type,realism_level,tone_keywords,virality_forecast_score,hook_variants_json
karmafables,https://www.youtube.com/watch?v=FOtgZ3-CStM,"I gave my cheating husband exactly what he wanted for his birthday, and he regretted asking for it.",tables_turned,high,"confident, sharp, satisfying, ironic, feminine, triumphant, poetic",0.93,"{""story_type"": ""tables_turned"", ""realism_level"": ""high"", ""hooks"": [{""hook_type"": ""shock"", ""energy"": ""high"", ""pattern"": ""I gave my ___ exactly what they asked for, and they instantly regretted it."", ""opening_style"": ""confident, direct, with a hint of irony and poetic justice"", ""comment_bait"": ""Viewers love the instant karma and poetic twist, prompting reactions and personal stories.""}, {""hook_type"": ""confession"", ""energy"": ""high"", ""pattern"": ""When someone tells you they want ___, sometimes the best gift is giving it to them—no matter the cost."", ""opening_style"": ""reflective, sharp, and self-assured, with a triumphant undertone"", ""comment_bait"": ""Invites debate about boundaries, empowerment, and whether the action was justified.""}, {""hook_type"": ""stakes"", ""energy"": ""medium"", ""pattern"": ""He said he wanted ___ for his birthday—so I delivered it, with a bow on top."", ""opening_style"": ""witty, feminine, and a bit playful, setting up for a twist"", ""comment_bait"": ""Sparks curiosity about what happened next and how far the storyteller went.""}, {""hook_type"": ""question"", ""energy"": ""high"", ""pattern"": ""What do you do when the person you love asks for something that will destroy you both?"", ""opening_style"": ""thoughtful, dramatic, and emotionally charged"", ""comment_bait"": ""Encourages viewers to share advice, opinions, and similar experiences.""}, {""hook_type"": ""mystery"", ""energy"": ""medium"", ""pattern"": ""He thought he was getting away with ___—until I handed him the one thing he never expected."", ""opening_style"": ""teasing, suspenseful, with a hint of satisfaction"", ""comment_bait"": ""Drives speculation about the twist and invites people to guess the outcome.""}, {""hook_type"": ""confession"", ""energy"": ""medium"", ""pattern"": ""Sometimes, the best revenge is giving someone exactly what they wished for."", ""opening_style"": ""calm, poetic, and self-empowered"", ""comment_bait"": ""Prompts viewers to discuss poetic justice and share their own stories of revenge.""}]}"
uncannyconfessions,https://www.youtube.com/watch?v=beUEMQt-jkM,What was the scariest “We need to leave... now” feeling you've had?,gut_instinct_escape,high,creepy; suspenseful; gut-instinct; protective; relief; vigilance; real-world threat; caution,1.03,"{""story_type"": ""gut_instinct_escape"", ""realism_level"": ""high"", ""hooks"": [{""hook_type"": ""question"", ""energy"": ""high"", ""pattern"": ""What was the scariest moment your instincts told you to leave right now"", ""opening_style"": ""Direct, conversational, sets up suspense with a personal challenge"", ""comment_bait"": ""Invites viewers to share their own gut-feeling stories and compare experiences""}, {""hook_type"": ""confession"", ""energy"": ""medium"", ""pattern"": ""I never thought I’d be the kind of person to get a bad feeling and run, but then ___ happened."", ""opening_style"": ""Relatable, self-aware, draws in viewers with vulnerability"", ""comment_bait"": ""Makes people reflect on their own instincts and moments they ignored or followed them""}, {""hook_type"": ""stakes"", ""energy"": ""high"", ""pattern"": ""You know that feeling when something’s just off, and you have to decide: trust your gut or risk it"", ""opening_style"": ""Urgent, suspenseful, puts the viewer in the moment"", ""comment_bait"": ""Triggers debate about trusting instincts versus overreacting""}, {""hook_type"": ""mystery"", ""energy"": ""medium"", ""pattern"": ""Have you ever met someone who made you want to disappear before they even said a word"", ""opening_style"": ""Creepy, intriguing, sets up an unsettling scenario"", ""comment_bait"": ""Encourages sharing of similar eerie encounters and stranger-danger stories""}, {""hook_type"": ""question"", ""energy"": ""medium"", ""pattern"": ""Ever had a split-second decision that probably saved you from something bad"", ""opening_style"": ""Reflective, conversational, invites personal connection"", ""comment_bait"": ""Prompts viewers to recount their own near-miss or close-call moments""}, {""hook_type"": ""stakes"", ""energy"": ""high"", ""pattern"": ""If you ever get that sudden urge to run, here’s why you should always listen to it."", ""opening_style"": ""Advisory, suspenseful, hints at a lesson learned the hard way"", ""comment_bait"": ""Sparks discussion about instinct, safety, and lessons from real-life scares""}]}"
uncannyconfessions,https://www.youtube.com/watch?v=_n0b_NqdPaA,"Forest rangers, what are your unexplainable and down right creepy stories?",haunting_reflection,high,melancholic; reflective; tragic; romantic; eerie; compassionate; slow-paced; haunting,1.11,"{""story_type"": ""haunting_reflection"", ""realism_level"": ""high"", ""hooks"": [{""hook_type"": ""question"", ""energy"": ""high"", ""pattern"": ""Forest rangers, what are your unexplainable and downright creepy stories?"", ""opening_style"": ""Directly addresses a specific group, inviting real, chilling experiences with a somber tone"", ""comment_bait"": ""Invites personal stories and debates about truth versus fiction""}, {""hook_type"": ""question"", ""energy"": ""medium"", ""pattern"": ""Have you ever heard a story that was both tragic and beautiful at the same time?"", ""opening_style"": ""Reflective and emotional, sets up a bittersweet narrative"", ""comment_bait"": ""Prompts people to share similar experiences or discuss the emotional impact""}, {""hook_type"": ""mystery"", ""energy"": ""medium"", ""pattern"": ""What would you do if you found something in the woods that you couldnt explain?"", ""opening_style"": ""Curious and suspenseful, hints at an unsettling discovery"", ""comment_bait"": ""Encourages speculation and sharing of personal theories""}, {""hook_type"": ""confession"", ""energy"": ""medium"", ""pattern"": ""One story my friend told me as a park ranger still haunts me to this day."", ""opening_style"": ""Personal and intimate, draws listeners in with a sense of lingering impact"", ""comment_bait"": ""Makes people ask for details and share their own haunting memories""}, {""hook_type"": ""stakes"", ""energy"": ""medium"", ""pattern"": ""Sometimes, the most peaceful places hide the saddest secrets."", ""opening_style"": ""Poetic and melancholic, sets a haunting atmosphere from the start"", ""comment_bait"": ""Invites interpretations and emotional reactions about the duality of places""}, {""hook_type"": ""question"", ""energy"": ""medium"", ""pattern"": ""What happens when love and loss meet in the middle of nowhere?"", ""opening_style"": ""Philosophical and evocative, frames the story as a universal dilemma"", ""comment_bait"": ""Encourages debate about love, mortality, and meaning""}]}"
karmafables,https://www.youtube.com/watch?v=GOAOfRBBsns,"My friends traumatized a burglar, but it was so funny we got away with it",tables_turned,medium,comedic; chaotic; karma; absurd; playful; shocking; mischievous; fast-paced,1.07,"{""story_type"": ""tables_turned"", ""realism_level"": ""medium"", ""hooks"": [{""hook_type"": ""shock"", ""energy"": ""high"", ""pattern"": ""Ever seen a burglar get traumatized by the people he tried to rob?"", ""opening_style"": ""Direct bold and playful with a hint of disbelief"", ""comment_bait"": ""Viewers debate if the story is real or staged and share similar wild justice stories""}, {""hook_type"": ""stakes"", ""energy"": ""high"", ""pattern"": ""It was 3 a.m., we heard someone breaking in, and what happened next was pure chaos."", ""opening_style"": ""Fast-paced cinematic sets the scene with tension and anticipation"", ""comment_bait"": ""People share their own late-night scares or react to the suspenseful setup""}, {""hook_type"": ""confession"", ""energy"": ""medium"", ""pattern"": ""I probably shouldnt admit this but we turned a break-in into the funniest night of our lives."", ""opening_style"": ""Mischievous conspiratorial invites the audience into a secret"", ""comment_bait"": ""Encourages debate about morality legality and personal experiences""}, {""hook_type"": ""question"", ""energy"": ""high"", ""pattern"": ""What would you do if a burglar tried to break in while you were still awake?"", ""opening_style"": ""Conversational hypothetical directly addresses the viewer"", ""comment_bait"": ""Prompts viewers to share opinions advice or their own stories""}, {""hook_type"": ""mystery"", ""energy"": ""medium"", ""pattern"": ""Theres a reason our apartment is now legendary in the neighborhood and it all started with a midnight break-in."", ""opening_style"": ""Teasing builds curiosity hints at a wild payoff"", ""comment_bait"": ""Makes people guess what happened or ask for more details""}, {""hook_type"": ""stakes"", ""energy"": ""high"", ""pattern"": ""We turned a terrifying break-in into viral karma and heres how it went down."", ""opening_style"": ""Bold summary-style promises chaos and justice"", ""comment_bait"": ""Invites reactions about justice karma and the absurdity of the situation""}]}"
householdhavoc,https://www.youtube.com/watch?v=8JJDmkjuehM,I refuse to give up my..,family_drama,high,humorous; relatable; petty; assertive; calm; dramatic; satisfying; grounded,1.09,"{""story_type"": ""family_drama"", ""realism_level"": ""high"", ""hooks"": [{""hook_type"": ""confession"", ""energy"": ""high"", ""pattern"": ""I refused to give up ___ to ___."", ""opening_style"": ""Direct, assertive, and personal; jumps straight into the conflict with a bold statement."", ""comment_bait"": ""Invites people to take sides and share their own similar experiences or judgments.""}, {""hook_type"": ""stakes"", ""energy"": ""high"", ""pattern"": ""Would you ever stand your ground over ___, even if it meant upsetting ___?"", ""opening_style"": ""Conversational and hypothetical; frames the story as a relatable dilemma."", ""comment_bait"": ""Prompts debate and personal anecdotes about boundaries and family drama.""}, {""hook_type"": ""shock"", ""energy"": ""medium"", ""pattern"": ""You wont believe what happened when ___ tried to take ___ from me."", ""opening_style"": ""Teasing and dramatic; sets up anticipation for a petty or outrageous scenario."", ""comment_bait"": ""Drives curiosity and speculation about the storys outcome.""}, {""hook_type"": ""question"", ""energy"": ""medium"", ""pattern"": ""Is it petty to refuse ___ when ___ demands it?"", ""opening_style"": ""Relatable and self-aware; invites viewers to weigh in on the morality of the situation."", ""comment_bait"": ""Encourages hot takes and opinions about what counts as petty or justified.""}, {""hook_type"": ""confession"", ""energy"": ""medium"", ""pattern"": ""Maybe Im the bad guy, but I just couldnt let ___ have ___."", ""opening_style"": ""Playful, slightly self-deprecating; acknowledges potential controversy."", ""comment_bait"": ""Sparks debate over whos right or wrong and invites people to share their judgments.""}, {""hook_type"": ""mystery"", ""energy"": ""medium"", ""pattern"": ""Theres one thing I absolutely refused to give up, no matter how much ___ insisted."", ""opening_style"": ""Intriguing and suspenseful; hints at a standoff without revealing details."", ""comment_bait"": ""Makes viewers curious about the specifics and eager to hear the full story.""}]}"
oddlypeople,https://www.youtube.com/watch?v=x5m9Gvj7Moc,"Parents, what's the FUNNIEST thing your KID has ever DONE? 📝🤑",tables_turned,low,comedic; ironic; youthful; lighthearted; mischievous; clever; moral; fast-paced,1.02,"{""story_type"": ""tables_turned"", ""realism_level"": ""low"", ""hooks"": [{""hook_type"": ""question"", ""energy"": ""high"", ""pattern"": ""Parents, what is the wildest thing your kid has ever pulled off at school?"", ""opening_style"": ""direct address, playful, conversational"", ""comment_bait"": ""invites viewers to share their own stories or call out exaggeration""}, {""hook_type"": ""confession"", ""energy"": ""medium"", ""pattern"": ""I never expected my kid to outsmart his teachers like this, but here we are."", ""opening_style"": ""casual, self-aware, slightly incredulous"", ""comment_bait"": ""sparks debate about believability and parenting""}, {""hook_type"": ""mystery"", ""energy"": ""high"", ""pattern"": ""When my kid suddenly had a wad of cash, I knew something was up."", ""opening_style"": ""suspenseful, brisk, sets up intrigue"", ""comment_bait"": ""gets people guessing what happened next""}, {""hook_type"": ""stakes"", ""energy"": ""medium"", ""pattern"": ""It all started when my son offered to pay for dinner—at age eleven."", ""opening_style"": ""ironic, humorous, fast-paced"", ""comment_bait"": ""draws in viewers with the absurdity and invites jokes""}, {""hook_type"": ""shock"", ""energy"": ""high"", ""pattern"": ""Turns out, my kid was running a business at school—and nobody noticed."", ""opening_style"": ""matter-of-fact, mischievous, punchy"", ""comment_bait"": ""provokes reactions about cleverness, ethics, and disbelief""}]}"
householdhavoc,https://www.youtube.com/watch?v=FpSdooOrmsU,#gameape,family_drama,high,emotional; redemptive; humble; inspiring; grounded; heartfelt; satisfying; calm,1.12,"{""story_type"": ""family_drama"", ""realism_level"": ""high"", ""hooks"": [{""hook_type"": ""shock"", ""energy"": ""high"", ""pattern"": ""When someone told me I wasnt good enough for their family, I just smiled."", ""opening_style"": ""calm, understated, direct first-person statement"", ""comment_bait"": ""People want to defend or debate the unfair judgment, and share their own stories of being underestimated.""}, {""hook_type"": ""confession"", ""energy"": ""medium"", ""pattern"": ""I could have argued back, but instead I chose quiet dignity."", ""opening_style"": ""reflective, humble, first-person with a twist on expected reaction"", ""comment_bait"": ""Viewers relate to choosing restraint over confrontation and may share similar experiences.""}, {""hook_type"": ""stakes"", ""energy"": ""medium"", ""pattern"": ""She said I wasnt good enoughmonths later, she begged me not to leave."", ""opening_style"": ""matter-of-fact, timeline-jumping, reveals reversal up front"", ""comment_bait"": ""People are intrigued by the reversal and want to know how it happened.""}, {""hook_type"": ""mystery"", ""energy"": ""medium"", ""pattern"": ""I never expected her to show up unannounced that day."", ""opening_style"": ""quiet suspense, sets up unexpected confrontation, first-person"", ""comment_bait"": ""Viewers speculate about what happened and share their own surprise visits.""}, {""hook_type"": ""question"", ""energy"": ""medium"", ""pattern"": ""What do you do when someone says youre not good enough for their family?"", ""opening_style"": ""inviting, conversational, directly addresses the audience"", ""comment_bait"": ""Prompts viewers to share advice, opinions, and personal stories.""}]}"
householdhavoc,https://www.youtube.com/watch?v=76ExP03ge1c,#gameape,family_drama,medium,comedic; dramatic; defiant; empowering; ironic; emotional; fast-paced; viral,1.05,"{""story_type"": ""family_drama"", ""realism_level"": ""medium"", ""hooks"": [{""hook_type"": ""confession"", ""energy"": ""high"", ""pattern"": ""My family forced me to change for someone elses big day and then freaked out when I actually did."", ""opening_style"": ""Direct, dramatic, and personal with a twist of irony"", ""comment_bait"": ""Invites debate on family expectations and authenticity, prompting people to share similar stories or question the truth""}, {""hook_type"": ""stakes"", ""energy"": ""high"", ""pattern"": ""They told me if I didnt fit their image, I couldnt be part of the most important event in our family."", ""opening_style"": ""Urgent and emotionally charged, setting up a high-stakes ultimatum"", ""comment_bait"": ""Makes viewers pick sides and argue about fairness, family loyalty, and body image""}, {""hook_type"": ""shock"", ""energy"": ""high"", ""pattern"": ""Imagine being told your body would ruin your sisters wedding photos."", ""opening_style"": ""Conversational and incredulous, using a what-if scenario to grab attention"", ""comment_bait"": ""Shocks viewers into reacting, sharing outrage, or questioning if this really happened""}, {""hook_type"": ""question"", ""energy"": ""medium"", ""pattern"": ""What happens when you finally become the person they demanded and they cant handle it?"", ""opening_style"": ""Rhetorical and reflective, inviting curiosity about the fallout"", ""comment_bait"": ""Sparks speculation and personal anecdotes about transformations and family backlash""}, {""hook_type"": ""mystery"", ""energy"": ""medium"", ""pattern"": ""For 27 years, I was invisible until one family demand changed everything."", ""opening_style"": ""Moody and cinematic, hinting at a dramatic turning point"", ""comment_bait"": ""Encourages people to guess what happened and relate to feeling overlooked""}, {""hook_type"": ""confession"", ""energy"": ""high"", ""pattern"": ""If they wanted a transformation, they were about to get one but not the way they expected."", ""opening_style"": ""Defiant and teasing, promising a twist on expectations"", ""comment_bait"": ""Makes viewers anticipate revenge or a glow-up, leading to hype and meme responses""}]}"
stupidluckfiles,https://www.youtube.com/watch?v=6ndUSXb6uOY,What’s the funniest thing you’ve received in a care package? 📦🧖♂️,military_prank,high,humorous; nostalgic; military; ironic; grounded; absurd; witty; camaraderie,1.15,"{""story_type"": ""military_prank"", ""realism_level"": ""high"", ""hooks"": [{""hook_type"": ""question"", ""energy"": ""high"", ""pattern"": ""Whats the most ridiculous thing youve ever received in a care package?"", ""opening_style"": ""Conversational direct address sets up anticipation for a wild story"", ""comment_bait"": ""Invites viewers to share their own experiences and compare absurdities""}, {""hook_type"": ""confession"", ""energy"": ""medium"", ""pattern"": ""I never thought Id see a drill sergeant lose his cool over a postcard but then this happened..."", ""opening_style"": ""Personal anecdote sets up irony and surprise first-person"", ""comment_bait"": ""Makes people want to share similar moments when authority figures cracked""}, {""hook_type"": ""shock"", ""energy"": ""high"", ""pattern"": ""Imagine your most embarrassing letter being read aloud to an entire platoonnow add a twist."", ""opening_style"": ""Vivid scenario second-person amps up tension and curiosity"", ""comment_bait"": ""Triggers empathy and stories about public embarrassment""}, {""hook_type"": ""stakes"", ""energy"": ""medium"", ""pattern"": ""Back in basic training one prank changed the way our whole platoon saw mail call."", ""opening_style"": ""Nostalgic setup hints at consequences group-focused"", ""comment_bait"": ""Prompts debate on bestworst pranks and group dynamics""}, {""hook_type"": ""mystery"", ""energy"": ""medium"", ""pattern"": ""You wont believe what showed up in our care package room overseas."", ""opening_style"": ""Teaser leaves out key detail hooks with curiosity"", ""comment_bait"": ""Gets people guessing and sharing their own bizarre care package stories""}, {""hook_type"": ""question"", ""energy"": ""medium"", ""pattern"": ""Ever wondered how a single postcard could turn a drill sergeant speechless?"", ""opening_style"": ""Rhetorical playful sets up an unexpected outcome"", ""comment_bait"": ""Encourages speculation and sharing of similar military humor""}]}"
oddlypeople,https://www.youtube.com/watch?v=gikUiF-zeVk,"Teachers, what's the FUNNIEST thing the WEIRD KID has ever DONE in your CLASS? 😳💨",classroom_chaos,high,comedic; absurd; chaotic; empathetic; playful; relatable; outrageous; wholesome,1.28,"{""story_type"": ""classroom_chaos"", ""realism_level"": ""high"", ""hooks"": [{""hook_type"": ""question"", ""energy"": ""high"", ""pattern"": ""Teachers, what is the wildest thing the weird kid ever did in your class?"", ""opening_style"": ""Direct, conversational, sets up anticipation for a bizarre story"", ""comment_bait"": ""Invites people to share their own outrageous classroom stories""}, {""hook_type"": ""confession"", ""energy"": ""medium"", ""pattern"": ""I never thought Id see a student save the day with a fart, but here we are."", ""opening_style"": ""Playful, self-aware, hooks with unexpected honesty"", ""comment_bait"": ""Makes viewers admit similar moments or react with disbelief""}, {""hook_type"": ""shock"", ""energy"": ""high"", ""pattern"": ""The moment I realized my class would never recover from what happened next..."", ""opening_style"": ""Dramatic pause, suspenseful, teases chaos"", ""comment_bait"": ""Drives curiosity and speculation about the incident""}, {""hook_type"": ""stakes"", ""energy"": ""medium"", ""pattern"": ""How do you handle it when a kids embarrassment could derail the whole class?"", ""opening_style"": ""Relatable, empathetic, sets up a dilemma"", ""comment_bait"": ""Encourages debate and advice-sharing in the comments""}, {""hook_type"": ""mystery"", ""energy"": ""high"", ""pattern"": ""Youll never guess how the weirdest kid in class became an absolute legend."", ""opening_style"": ""Teasing, playful, promises a twist"", ""comment_bait"": ""Prompts guesses and hype for the reveal""}, {""hook_type"": ""question"", ""energy"": ""medium"", ""pattern"": ""Ever witnessed a student turn total chaos into pure comedy?"", ""opening_style"": ""Conversational, inclusive, sets up a funny story"", ""comment_bait"": ""Invites viewers to share their own funny classroom chaos moments""}]}"
householdhavoc,https://www.youtube.com/watch?v=nWO8Swwn1IM,How did your parents mess up your childhood? #reddit #story #redditstories,family_drama,low,dark; absurd; comedic; critical; reflective; fast-paced; detached; exaggerated,0.96,"{""story_type"": ""family_drama"", ""realism_level"": ""low"", ""hooks"": [{""hook_type"": ""question"", ""energy"": ""high"", ""pattern"": ""How did your parents completely mess up your childhood?"", ""opening_style"": ""Direct, provocative, and conversational with a hint of dark humor"", ""comment_bait"": ""Invites people to share their own stories or debate the validity of the experience""}, {""hook_type"": ""shock"", ""energy"": ""high"", ""pattern"": ""Parents leave a kid alone for ___ days to teach responsibility what could possibly go wrong?"", ""opening_style"": ""Absurd, exaggerated, and fast-paced with a detached delivery"", ""comment_bait"": ""Shocks viewers into disbelief or skepticism, prompting arguments and memes""}, {""hook_type"": ""stakes"", ""energy"": ""medium"", ""pattern"": ""When I was ___ years old, my parents trusted me with the house for ___ days. Spoiler it did not go well."", ""opening_style"": ""Reflective and comedic, setting up chaos with a dry tone"", ""comment_bait"": ""Sets up anticipation for disaster, encouraging people to guess or share similar stories""}, {""hook_type"": ""confession"", ""energy"": ""medium"", ""pattern"": ""I survived the kind of parenting that would get you canceled today."", ""opening_style"": ""Detached, critical, and slightly exaggerated for comedic effect"", ""comment_bait"": ""Triggers debate on parenting standards and authenticity""}, {""hook_type"": ""mystery"", ""energy"": ""medium"", ""pattern"": ""Ever wonder what happens when a kid is left alone for days? Let me tell you."", ""opening_style"": ""Teasing and fast-paced, inviting curiosity with a hint of absurdity"", ""comment_bait"": ""Encourages speculation and sharing of similar or contrasting experiences""}]}"
