most_similar_channel,reference_link,title,story_type,realism_level,tone_keywords,virality_forecast_score,hook_variants_json
oddlypeople,https://www.youtube.com/watch?v=Af5mnqFcZ04,Have you ever been recruited as a last-minute bridesmaid at a wedding at a public park?,absurd_encounter,medium,"wholesome, absurd, romantic, fast-paced, ironic, playful, cinematic",0.91,"{""story_type"": ""absurd_encounter"", ""realism_level"": ""medium"", ""hooks"": [{""hook_type"": ""question"", ""energy"": ""high"", ""pattern"": ""Have you ever been recruited as a last-minute ___ in the middle of ___?"", ""opening_style"": ""Direct, playful, and incredulous question that throws the viewer into the action"", ""comment_bait"": ""Invites people to share their own wild or unexpected experiences""}, {""hook_type"": ""confession"", ""energy"": ""high"", ""pattern"": ""I never thought ___ would happen to me, but then ___ stopped me and said ___"", ""opening_style"": ""Fast-paced, cinematic, and self-aware intro that sets up the absurdity"", ""comment_bait"": ""Makes viewers want to guess what happens next or share disbelief""}, {""hook_type"": ""shock"", ""energy"": ""high"", ""pattern"": ""One minute I was ___, the next I was being pulled into ___ by a total stranger"", ""opening_style"": ""Immediate, action-driven, and visually vivid phrasing"", ""comment_bait"": ""Prompts people to comment about similar sudden twists or to react to the chaos""}, {""hook_type"": ""stakes"", ""energy"": ""medium"", ""pattern"": ""If you have ever wondered what it is like to be thrown into ___ with zero warning, let me tell you"", ""opening_style"": ""Conversational, slightly ironic, and sets up high-stakes absurdity"", ""comment_bait"": ""Encourages people to imagine themselves in the situation and respond""}, {""hook_type"": ""mystery"", ""energy"": ""medium"", ""pattern"": ""This is the story of how I accidentally became ___ at a complete stranger's ___"", ""opening_style"": ""Playful, cinematic, and slightly self-deprecating"", ""comment_bait"": ""Makes viewers curious about the backstory and eager to hear the details""}]}"
stupidluckfiles,https://www.youtube.com/watch?v=3xwt4ZnzU-o,What happened in a courtroom that gave the judge a belly laugh?,ironic_courtroom,high,"sarcastic, ironic, dry, comedic, slow-paced, courtroom, meme-coded",0.68,"{""story_type"": ""ironic_courtroom"", ""realism_level"": ""high"", ""hooks"": [{""hook_type"": ""question"", ""energy"": ""high"", ""pattern"": ""What happened in a courtroom that made even the judge lose it"", ""opening_style"": ""dry, direct, and curiosity-driven with a hint of sarcasm"", ""comment_bait"": ""Invites disbelief and meme responses about real-life absurdity""}, {""hook_type"": ""question"", ""energy"": ""high"", ""pattern"": ""Ever seen a legal case turn into a perfect punchline"", ""opening_style"": ""sarcastic, meme-coded, and slightly mocking"", ""comment_bait"": ""Prompts people to share their own you had to be there stories""}, {""hook_type"": ""question"", ""energy"": ""medium"", ""pattern"": ""How does a routine court case end up as a meme in real life"", ""opening_style"": ""ironic and slow-paced, setting up for a twist"", ""comment_bait"": ""Gets people debating if the story could really happen""}, {""hook_type"": ""question"", ""energy"": ""medium"", ""pattern"": ""What is the most unexpected thing you have ever seen in a courtroom"", ""opening_style"": ""dry and conversational, inviting speculation"", ""comment_bait"": ""Encourages commenters to one-up the story or call it out""}, {""hook_type"": ""question"", ""energy"": ""high"", ""pattern"": ""Can a dashcam video actually make a judge laugh out loud"", ""opening_style"": ""sarcastic, meme-aware, and concise"", ""comment_bait"": ""Triggers meme references and disbelief in the comments""}]}"
oddlypeople,https://www.youtube.com/watch?v=afR2qzmUOI4,#birdtrend,identity_spiral,low,"absurd, ironic, comedic, fast-paced, surreal, playful, identity",0.83,"{""story_type"": ""identity_spiral"", ""realism_level"": ""low"", ""hooks"": [{""hook_type"": ""question"", ""energy"": ""high"", ""pattern"": ""Have you ever made up a name and then actually had to live with it"", ""opening_style"": ""playful, direct, absurd hypothetical that invites self-reflection"", ""comment_bait"": ""Invites people to share their own nickname stories or escalate the absurdity""}, {""hook_type"": ""confession"", ""energy"": ""high"", ""pattern"": ""So, I did something ridiculous at a place everyone goes to and now I cant escape it"", ""opening_style"": ""fast-paced, ironic, immediately self-deprecating"", ""comment_bait"": ""Makes viewers want to guess what happened or share similar accidental chaos""}, {""hook_type"": ""question"", ""energy"": ""medium"", ""pattern"": ""Whats the weirdest thing youve ever been called in publicand did it stick"", ""opening_style"": ""conversational, surreal, invites audience participation"", ""comment_bait"": ""Prompts people to one-up each other with their own stories""}, {""hook_type"": ""mystery"", ""energy"": ""high"", ""pattern"": ""You know that moment when a joke goes way too far Yeah, that just happened to me"", ""opening_style"": ""teasing, comedic, sets up escalating absurdity"", ""comment_bait"": ""Builds curiosity for how things spiraled and encourages speculation""}, {""hook_type"": ""confession"", ""energy"": ""medium"", ""pattern"": ""I accidentally started a trend and now my life is a meme"", ""opening_style"": ""ironic, meta, breaks the fourth wall with playful exaggeration"", ""comment_bait"": ""Invites jokes about virality and meme culture, sparks playful disbelief""}]}"
empathhero,https://www.youtube.com/watch?v=KD3mAyO7qkg,#petshub,family_drama,high,"emotional, sincere, moral, sentimental, reflective, bittersweet, slow-paced",0.91,"{""story_type"": ""family_drama"", ""realism_level"": ""high"", ""hooks"": [{""hook_type"": ""confession"", ""energy"": ""medium"", ""pattern"": ""I never thought I would be standing at my fathers grave, surrounded by people who cared more about money than memories."", ""opening_style"": ""gentle, reflective, and emotionally direct"", ""comment_bait"": ""Invites empathy and personal stories about loss or family conflict""}, {""hook_type"": ""stakes"", ""energy"": ""high"", ""pattern"": ""Today, I learned what truly matters when family is torn between love and greed."", ""opening_style"": ""solemn, sincere, setting up a moral dilemma"", ""comment_bait"": ""Sparks debate about values and personal experiences with inheritance or family disputes""}, {""hook_type"": ""shock"", ""energy"": ""medium"", ""pattern"": ""At my dads funeral, I discovered a secret that changed everything."", ""opening_style"": ""matter-of-fact with a hint of suspense"", ""comment_bait"": ""Drives curiosity and speculation about the twist""}, {""hook_type"": ""mystery"", ""energy"": ""medium"", ""pattern"": ""When the lawyer handed us three boxes at my fathers grave, I had no idea what was inside."", ""opening_style"": ""calm, descriptive, building intrigue"", ""comment_bait"": ""Encourages guesses and engagement about the outcome""}, {""hook_type"": ""stakes"", ""energy"": ""high"", ""pattern"": ""Would you honor your parents last wish, even if everyone else walked away?"", ""opening_style"": ""direct address, moral and contemplative"", ""comment_bait"": ""Prompts viewers to share their own values and judgments""}, {""hook_type"": ""confession"", ""energy"": ""low"", ""pattern"": ""I was the only one who stayed when everyone else left my fathers side."", ""opening_style"": ""soft, sentimental, first-person"", ""comment_bait"": ""Elicits sympathy and stories of loyalty or regret""}]}"
empathhero,https://www.youtube.com/watch?v=BTT-7nxFtUc,#birdtrend,family_drama,high,"dark, redemptive, moral, unsettling, fast-paced, reflective, ironic",0.85,"{""story_type"": ""family_drama"", ""realism_level"": ""high"", ""hooks"": [{""hook_type"": ""question"", ""energy"": ""high"", ""pattern"": ""What is the darkest thing you have ever done and do not regret?"", ""opening_style"": ""Direct, provocative, and personal; immediately challenges the viewers morals"", ""comment_bait"": ""Invites confession, debate, and moral judgment from viewers""}, {""hook_type"": ""confession"", ""energy"": ""high"", ""pattern"": ""I did something most people would never forgive, but I never looked back."", ""opening_style"": ""Bold, unapologetic, and intriguing; sets up a shocking reveal"", ""comment_bait"": ""Sparks curiosity and demands viewers weigh in on right vs wrong""}, {""hook_type"": ""shock"", ""energy"": ""high"", ""pattern"": ""When I was only blank, I made a choice that changed my family forever."", ""opening_style"": ""Matter-of-fact yet ominous; hints at a pivotal, life-altering event"", ""comment_bait"": ""Makes people guess what happened and share their own stories""}, {""hook_type"": ""stakes"", ""energy"": ""medium"", ""pattern"": ""It started with a single moment of anger, and ended with someone in the hospital."", ""opening_style"": ""Narrative, suspenseful, and concise; quickly escalates tension"", ""comment_bait"": ""Draws in viewers who crave drama and high-stakes situations""}, {""hook_type"": ""mystery"", ""energy"": ""medium"", ""pattern"": ""If I told you what really happened that night, would you believe me?"", ""opening_style"": ""Reflective, slightly conspiratorial; invites the audience into a secret"", ""comment_bait"": ""Encourages disbelief, speculation, and personal theories in comments""}]}"
empathhero,https://www.youtube.com/watch?v=_6IF-svmha8,#smartgaudget,family_hero,high,"emotional, uplifting, heartfelt, wholesome, fast-paced, sincere, family-focused",0.94,"{""story_type"": ""family_hero"", ""realism_level"": ""high"", ""hooks"": [{""hook_type"": ""confession"", ""energy"": ""medium"", ""pattern"": ""No one ever believes me when I say my ___ saved my life."", ""opening_style"": ""gentle disbelief, soft-spoken, heartfelt and sincere"", ""comment_bait"": ""Invites people to share their own stories of being underestimated or surprising acts from loved ones.""}, {""hook_type"": ""stakes"", ""energy"": ""high"", ""pattern"": ""If ___ had been just two minutes slower, I might not be here to tell this story."", ""opening_style"": ""urgent but emotional, fast-paced with a personal touch"", ""comment_bait"": ""Prompts shock, support, and emotional reactions about the close call.""}, {""hook_type"": ""mystery"", ""energy"": ""medium"", ""pattern"": ""Everyone thinks they know what my ___ can do, but they have no idea what happened that day."", ""opening_style"": ""curious, slightly suspenseful, inviting listeners in"", ""comment_bait"": ""Encourages curiosity and speculation about the unexpected hero moment.""}, {""hook_type"": ""shock"", ""energy"": ""high"", ""pattern"": ""My ___ became my hero in a way nobody could have predicted."", ""opening_style"": ""bold, direct, emotionally charged"", ""comment_bait"": ""Triggers comments about heroes in everyday life and personal experiences.""}, {""hook_type"": ""question"", ""energy"": ""medium"", ""pattern"": ""Have you ever seen someone everyone underestimated do something incredible?"", ""opening_style"": ""relatable, conversational, inviting audience reflection"", ""comment_bait"": ""Encourages viewers to share their own stories and connect emotionally.""}, {""hook_type"": ""confession"", ""energy"": ""medium"", ""pattern"": ""I never thought Id owe my life to my little ___, but heres what happened."", ""opening_style"": ""warm, honest, slightly surprised"", ""comment_bait"": ""Sparks empathy and stories about surprising acts from family members.""}]}"
scriptvault67,https://www.youtube.com/watch?v=hOTXV6XD_oY,#secondmarriage,school_tragedy,high,"dark, suspenseful, nostalgic, tragic, immersive, realistic, somber",0.81,"{""story_type"": ""school_tragedy"", ""realism_level"": ""high"", ""hooks"": [{""hook_type"": ""shock"", ""energy"": ""high"", ""pattern"": ""The day ___ stopped feeling safe."", ""opening_style"": ""Immediate, somber, and immersive with a sense of foreboding."", ""comment_bait"": ""Invites speculation and debate about what happened and if it could be real.""}, {""hook_type"": ""stakes"", ""energy"": ""high"", ""pattern"": ""Third period, ___ class, and then everything changed."", ""opening_style"": ""Nostalgic and specific, placing the listener directly in the scene."", ""comment_bait"": ""Prompts people to share their own school memories or fears.""}, {""hook_type"": ""mystery"", ""energy"": ""medium"", ""pattern"": ""It started with a voice on the PA that didnt sound right."", ""opening_style"": ""Realistic and understated, building tension through small details."", ""comment_bait"": ""Makes viewers curious about the unfolding events and eager to guess what happens next.""}, {""hook_type"": ""confession"", ""energy"": ""medium"", ""pattern"": ""I still get chills every time I hear ___, because of what happened that day."", ""opening_style"": ""Reflective and personal, hinting at trauma and unresolved fear."", ""comment_bait"": ""Encourages empathy and sharing of similar experiences.""}, {""hook_type"": ""stakes"", ""energy"": ""high"", ""pattern"": ""We were told to stay in our classrooms. This was not a drill."", ""opening_style"": ""Direct and urgent, mimicking official language to heighten anxiety."", ""comment_bait"": ""Triggers debate about school safety and personal memories of lockdowns.""}, {""hook_type"": ""mystery"", ""energy"": ""medium"", ""pattern"": ""No one expected the announcement that would change everything."", ""opening_style"": ""Vague yet ominous, setting up suspense from the first line."", ""comment_bait"": ""Drives curiosity and predictions about the storys direction.""}]}"
oddlypeople,https://www.youtube.com/watch?v=LkmoIFC5QhA,#smartgaudget,systemic_failure,high,"assertive, fast-paced, moral, chaotic, emotional, engaging, surreal",0.88,"{""story_type"": ""systemic_failure"", ""realism_level"": ""high"", ""hooks"": [{""hook_type"": ""question"", ""energy"": ""high"", ""pattern"": ""Whats the most unbelievable rule youve ever had to follow?"", ""opening_style"": ""assertive, direct, incredulous, fast-paced"", ""comment_bait"": ""Invites people to share their own outrageous experiences or debate the storys authenticity""}, {""hook_type"": ""shock"", ""energy"": ""high"", ""pattern"": ""Imagine being punished for trying to save a lifewould you break the rules?"", ""opening_style"": ""emotional, urgent, moral dilemma, confrontational"", ""comment_bait"": ""Provokes debate about right vs wrong and institutional logic""}, {""hook_type"": ""stakes"", ""energy"": ""high"", ""pattern"": ""Have you ever had to choose between following orders and doing the right thing?"", ""opening_style"": ""moral, reflective, personal, engaging"", ""comment_bait"": ""Sparks discussion about ethics, courage, and real-life choices""}, {""hook_type"": ""confession"", ""energy"": ""medium"", ""pattern"": ""I never thought a school rule could put someones life at riskuntil this happened."", ""opening_style"": ""personal, suspenseful, emotional, fast-paced"", ""comment_bait"": ""Draws in listeners with a promise of chaos and moral outrage""}, {""hook_type"": ""mystery"", ""energy"": ""medium"", ""pattern"": ""What would you do if the rules made it impossible to help your best friend?"", ""opening_style"": ""hypothetical, engaging, direct, emotional"", ""comment_bait"": ""Encourages people to imagine themselves in the situation and share opinions""}]}"
scriptvault67,https://www.youtube.com/watch?v=iHCXkuuxQCk,"The morning I was declared cancer-free, my nurse smiled and said, ""You were our favorite patient...",tables_turned,medium,"inspirational, emotional, investigative, cinematic, fast-paced, polished, moral",0.93,"{""story_type"": ""tables_turned"", ""realism_level"": ""medium"", ""hooks"": [{""hook_type"": ""shock"", ""energy"": ""high"", ""pattern"": ""The moment I thought I was safe, I overheard something that changed everything."", ""opening_style"": ""Direct, cinematic, immediate emotional whiplash"", ""comment_bait"": ""People debate if the twist is real, share similar shocking moments, or argue about plausibility.""}, {""hook_type"": ""mystery"", ""energy"": ""high"", ""pattern"": ""I was declared ____, but what I heard next made me question everything."", ""opening_style"": ""Suspenseful, fast-paced, sets up immediate doubt"", ""comment_bait"": ""Invites speculation and personal theories, encourages people to guess what happens next.""}, {""hook_type"": ""stakes"", ""energy"": ""high"", ""pattern"": ""After surviving ____, I thought the worst was over—until I heard ____."", ""opening_style"": ""Emotional, resilient, quickly raises the stakes"", ""comment_bait"": ""Prompts empathy and personal stories, especially from those with similar experiences.""}, {""hook_type"": ""confession"", ""energy"": ""medium"", ""pattern"": ""I never expected to hear ____ on the day I was supposed to celebrate ____."", ""opening_style"": ""Reflective, personal, bittersweet"", ""comment_bait"": ""Encourages people to share their own moments of unexpected betrayal or disappointment.""}, {""hook_type"": ""question"", ""energy"": ""medium"", ""pattern"": ""Have you ever realized too late that someone you trusted was hiding something?"", ""opening_style"": ""Conversational, direct address to the audience"", ""comment_bait"": ""Drives engagement by prompting people to share their own trust issues or suspicions.""}, {""hook_type"": ""shock"", ""energy"": ""high"", ""pattern"": ""The nurse smiled and said I was her favorite patient—seconds before I learned the truth."", ""opening_style"": ""Dramatic, polished, cinematic contrast"", ""comment_bait"": ""Sparks debate about character motives and realism, and invites reactions to the twist.""}]}"
karmafables,https://www.youtube.com/watch?v=1cdbkLvE_eg,What's the most ironic 'the tables have turned' moment you've seen?,tables_turned,high,"family legacy, irony, control, downfall, revenge, justice, karma, humiliation",0.68,"{""story_type"": ""tables_turned"", ""realism_level"": ""high"", ""hooks"": [{""hook_type"": ""question"", ""energy"": ""high"", ""pattern"": ""What is the most ironic moment when power completely flipped in your family?"", ""opening_style"": ""Direct, conversational, invites audience to recall personal stories"", ""comment_bait"": ""People love sharing their own stories of poetic justice or family drama""}, {""hook_type"": ""stakes"", ""energy"": ""high"", ""pattern"": ""Have you ever seen someone obsessed with control lose everything in a single moment?"", ""opening_style"": ""Dramatic, sets up high emotional stakes, uses vivid language"", ""comment_bait"": ""Triggers debate about control, karma, and downfall""}, {""hook_type"": ""mystery"", ""energy"": ""medium"", ""pattern"": ""You wont believe how one familys secret shattered their legacy in front of everyone."", ""opening_style"": ""Teasing, suspenseful, hints at a shocking reveal"", ""comment_bait"": ""Curiosity drives viewers to guess the twist or share similar secrets""}, {""hook_type"": ""confession"", ""energy"": ""medium"", ""pattern"": ""I watched the most powerful person I know lose everything in a single ceremony."", ""opening_style"": ""Personal, reflective, first-person perspective"", ""comment_bait"": ""Invites empathy and stories of witnessing someones downfall""}, {""hook_type"": ""shock"", ""energy"": ""high"", ""pattern"": ""Imagine building your entire life on a liethen having it exposed in front of your whole family."", ""opening_style"": ""Vivid, emotional, paints a dramatic scenario"", ""comment_bait"": ""Provokes strong reactions and debate about justice and karma""}]}"
householdhavoc,https://www.youtube.com/watch?v=RkBkiNXzJ1Y,My Wife With ADHD Ruined My Life 🥺💔 Reddit Stories,marriage_conflict,high,"frustration, empathy, accountability, realism, irony, marriage, conflict, fatigue",0.73,"{""story_type"": ""marriage_conflict"", ""realism_level"": ""high"", ""hooks"": [{""hook_type"": ""confession"", ""energy"": ""high"", ""pattern"": ""Living with someone who refuses to change can ruin your life ask me how I know."", ""opening_style"": ""Direct, weary, first-person admission with a hint of bitterness."", ""comment_bait"": ""Invites debate about blame, responsibility, and personal experience.""}, {""hook_type"": ""stakes"", ""energy"": ""high"", ""pattern"": ""How do you stay married when your partners habits take over your entire home?"", ""opening_style"": ""Rhetorical question, conversational, highlighting escalating tension."", ""comment_bait"": ""Triggers personal stories and strong opinions about boundaries and marriage.""}, {""hook_type"": ""shock"", ""energy"": ""medium"", ""pattern"": ""I never thought a diagnosis could make things worse, but here we are."", ""opening_style"": ""Matter-of-fact, slightly ironic, sets up unexpected twist."", ""comment_bait"": ""Sparks discussion about diagnoses, excuses, and accountability.""}, {""hook_type"": ""mystery"", ""energy"": ""medium"", ""pattern"": ""What do you do when the person you love finally admits there is a problem but nothing changes?"", ""opening_style"": ""Thoughtful, empathetic, invites audience to imagine themselves in the situation."", ""comment_bait"": ""Encourages advice, empathy, and debate about next steps.""}, {""hook_type"": ""question"", ""energy"": ""high"", ""pattern"": ""Is it wrong to want an apology for years of chaos, even if it was not all their fault?"", ""opening_style"": ""Self-reflective, vulnerable, prompts ethical debate."", ""comment_bait"": ""Provokes arguments about blame, forgiveness, and mental health.""}]}"
karmafables,https://www.youtube.com/watch?v=Tg7in-oWJ8s,I Poisoned My Thieving Roommate 😒💔 Reddit Stories,tables_turned,high,"justice, irony, revenge, karma, satisfaction, humor, accountability",0.91,"{""story_type"": ""tables_turned"", ""realism_level"": ""high"", ""hooks"": [{""hook_type"": ""confession"", ""energy"": ""high"", ""pattern"": ""I never thought getting revenge on a roommate could be this satisfying want to hear how I did it?"", ""opening_style"": ""direct, bold, conversational"", ""comment_bait"": ""invites debate about morality and personal experiences with revenge""}, {""hook_type"": ""shock"", ""energy"": ""high"", ""pattern"": ""Ever wonder what happens when a food thief finally gets caught in the most ironic way possible?"", ""opening_style"": ""teasing, dramatic, rhetorical"", ""comment_bait"": ""sparks curiosity and stories about poetic justice""}, {""hook_type"": ""stakes"", ""energy"": ""medium"", ""pattern"": ""When your roommate keeps stealing your food, how far would you go to make them stop?"", ""opening_style"": ""relatable, hypothetical, inviting"", ""comment_bait"": ""encourages people to share boundaries and deterrent ideas""}, {""hook_type"": ""question"", ""energy"": ""medium"", ""pattern"": ""What do you do when confronting a thief doesn't work and you want karma to do the talking?"", ""opening_style"": ""curious, slightly mischievous, reflective"", ""comment_bait"": ""gets people to weigh in on justice and creative solutions""}, {""hook_type"": ""mystery"", ""energy"": ""high"", ""pattern"": ""Guess who ended up exposing themselves after stealing my food one too many times?"", ""opening_style"": ""playful, suspenseful, inviting"", ""comment_bait"": ""prompts guesses and personal anecdotes""}, {""hook_type"": ""confession"", ""energy"": ""medium"", ""pattern"": ""Okay, maybe I went too far but would you have done the same in my situation?"", ""opening_style"": ""self-aware, informal, slightly defensive"", ""comment_bait"": ""provokes judgment and moral discussion""}]}"
