most_similar_channel,reference_link,title,story_type,realism_level,tone_keywords,virality_forecast_score,hook_variants_json
empathhero,https://www.youtube.com/watch?v=54_AVFldjVM,What's the CRAZIEST INCIDENT that ever HAPPENED at your SCHOOL? 📖🗣️,tables_turned,high,heartfelt; empowering; reflective; fast-paced; compassionate; uplifting; human; redemptive,0.93,"{""story_type"": ""tables_turned"", ""realism_level"": ""high"", ""hooks"": [{""hook_type"": ""question"", ""energy"": ""high"", ""pattern"": ""Whats the wildest thing that ever happened at your school"", ""opening_style"": ""direct, conversational, invites listener participation"", ""comment_bait"": ""prompts people to share their own school stories or compare experiences""}, {""hook_type"": ""stakes"", ""energy"": ""high"", ""pattern"": ""Have you ever seen a whole class stand up for someone when nobody expected it"", ""opening_style"": ""engaging, sets up anticipation, appeals to justice"", ""comment_bait"": ""sparks debate about group actions and solidarity""}, {""hook_type"": ""confession"", ""energy"": ""medium"", ""pattern"": ""I never thought my class would actually change the rules at our school, but then this happened."", ""opening_style"": ""reflective, personal, hints at transformation"", ""comment_bait"": ""invites people to discuss rule changes or similar moments""}, {""hook_type"": ""shock"", ""energy"": ""high"", ""pattern"": ""One day, everything in our classroom flipped upside down because of a single brave move."", ""opening_style"": ""dramatic, fast-paced, teases a turning point"", ""comment_bait"": ""encourages curiosity about the incident and reactions""}, {""hook_type"": ""mystery"", ""energy"": ""medium"", ""pattern"": ""Nobody expected what happened after we all started reading wrong on purpose."", ""opening_style"": ""intriguing, slightly playful, hints at collective action"", ""comment_bait"": ""makes viewers guess or speculate about the outcome""}, {""hook_type"": ""stakes"", ""energy"": ""medium"", ""pattern"": ""What would you do if you saw someone being mocked every single day in class"", ""opening_style"": ""empathetic, direct, challenges the viewer"", ""comment_bait"": ""sparks moral discussion and personal anecdotes""}]}"
karmafables,https://www.youtube.com/watch?v=KynYcLyt8qQ,Worked like a charm!,petty_revenge,high,calm; witty; slow-paced; satisfying; petty; clever; warm; humorous,1.08,"{""story_type"": ""petty_revenge"", ""realism_level"": ""high"", ""hooks"": [{""hook_type"": ""question"", ""energy"": ""medium"", ""pattern"": ""How do you politely tell someone theyve overstayed their welcome?"", ""opening_style"": ""calm, conversational, gently leading into the story"", ""comment_bait"": ""invites people to share their own awkward guest stories or solutions""}, {""hook_type"": ""confession"", ""energy"": ""medium"", ""pattern"": ""I never thought Id see someone outsmart freeloaders so effortlessly."", ""opening_style"": ""wry, self-aware, sets up admiration for a clever move"", ""comment_bait"": ""sparks agreement, praise, and personal anecdotes about clever relatives""}, {""hook_type"": ""question"", ""energy"": ""high"", ""pattern"": ""Whats the pettiest way youve ever gotten rid of unwanted guests?"", ""opening_style"": ""direct, playful, invites audience participation"", ""comment_bait"": ""encourages sharing of similar stories and one-upmanship""}, {""hook_type"": ""stakes"", ""energy"": ""medium"", ""pattern"": ""When dinner guests start showing up uninvited every night, what do you do?"", ""opening_style"": ""matter-of-fact, sets up the problem with a relatable scenario"", ""comment_bait"": ""relatability prompts people to vent or offer advice""}, {""hook_type"": ""mystery"", ""energy"": ""medium"", ""pattern"": ""Youll never guess how my grandpa finally got rid of our nightly dinner crashers."", ""opening_style"": ""teasing, draws curiosity with a promise of a twist"", ""comment_bait"": ""makes people guess or anticipate the reveal""}, {""hook_type"": ""shock"", ""energy"": ""high"", ""pattern"": ""Imagine watching someone let the dogs do the disheson purpose."", ""opening_style"": ""humorous, slightly outrageous, sets up the punchline"", ""comment_bait"": ""provokes laughter, disbelief, and meme responses""}]}"
karmafables,https://www.youtube.com/watch?v=cNR8CTldoQc,What karen did that BACKFIRED Onthem horribly?,tables_turned,medium,"petty-revenge, instant-karma, incredulous, triumphant, smug, witty, consumer-drama",0.88,"{""story_type"": ""tables_turned"", ""realism_level"": ""medium"", ""hooks"": [{""hook_type"": ""shock"", ""energy"": ""high"", ""pattern"": ""You wont believe what happened when someone tried to steal from my kids right in front of me."", ""opening_style"": ""Direct, incredulous, sets up immediate drama"", ""comment_bait"": ""Invites people to share outrage or similar experiences""}, {""hook_type"": ""question"", ""energy"": ""high"", ""pattern"": ""Ever seen karma hit someone instantly for being entitled?"", ""opening_style"": ""Conversational, rhetorical, sets up expectation of justice"", ""comment_bait"": ""Prompts stories about instant karma and opinions on fairness""}, {""hook_type"": ""stakes"", ""energy"": ""medium"", ""pattern"": ""All I wanted was a quiet shopping tripthen a stranger tried to ruin my kids holiday."", ""opening_style"": ""Relatable, sets up conflict and emotional stakes"", ""comment_bait"": ""Draws in parents and those who empathize with family drama""}, {""hook_type"": ""confession"", ""energy"": ""medium"", ""pattern"": ""I never thought Id see someone get exactly what they deserved at the checkout line."", ""opening_style"": ""Wry, knowing, hints at a satisfying payoff"", ""comment_bait"": ""Encourages people to debate what someone deserves and share similar moments""}, {""hook_type"": ""mystery"", ""energy"": ""high"", ""pattern"": ""Heres how a petty act in the toy aisle turned into public humiliation."", ""opening_style"": ""Teasing, sets up curiosity about the twist"", ""comment_bait"": ""Gets people guessing about the outcome and sharing their own twists""}]}"
oddlypeople,https://www.youtube.com/watch?v=h44eSL-N7xg,I’m Proud Of Myself For Being Rude To The Waiter 😒💔 Reddit Stories,tables_turned,high,"moral-outrage, vindication, cathartic, racial-injustice, assertive, empowering, dramatic, reflective",0.93,"{""story_type"": ""tables_turned"", ""realism_level"": ""high"", ""hooks"": [{""hook_type"": ""confession"", ""energy"": ""high"", ""pattern"": ""I never thought Id be proud of being rude to someone, but today changed that."", ""opening_style"": ""Direct, personal, and unapologetic, immediately owning the controversial action."", ""comment_bait"": ""Invites debate over whether rudeness is ever justified, sparking strong opinions.""}, {""hook_type"": ""shock"", ""energy"": ""high"", ""pattern"": ""Have you ever caught someone judging you before they even spoke to you?"", ""opening_style"": ""Conversational and challenging, prompting viewers to reflect on personal experiences."", ""comment_bait"": ""Encourages viewers to share similar stories or call out injustice.""}, {""hook_type"": ""stakes"", ""energy"": ""medium"", ""pattern"": ""This is the story of how I exposed someones true colors with one simple move."", ""opening_style"": ""Dramatic and suspenseful, hinting at a satisfying reveal."", ""comment_bait"": ""Builds anticipation for the twist, prompting guesses and reactions.""}, {""hook_type"": ""question"", ""energy"": ""medium"", ""pattern"": ""What would you do if you overheard someone stereotyping you to your face?"", ""opening_style"": ""Engaging and direct, placing the viewer in the narrators shoes."", ""comment_bait"": ""Invites viewers to share their own hypothetical responses or real experiences.""}, {""hook_type"": ""confession"", ""energy"": ""high"", ""pattern"": ""I did something most people would call petty, but I dont regret it for a second."", ""opening_style"": ""Bold and self-assured, teasing a controversial action."", ""comment_bait"": ""Provokes debate over the morality of the action, drawing strong support or criticism.""}, {""hook_type"": ""stakes"", ""energy"": ""high"", ""pattern"": ""Sometimes the only way to fight back is to break the rules."", ""opening_style"": ""Empowering and rebellious, setting up a story of justified defiance."", ""comment_bait"": ""Encourages discussion about when its okay to defy social norms.""}]}"
karmafables,https://www.youtube.com/watch?v=FOtgZ3-CStM,"I gave my cheating husband exactly what he wanted for his birthday, and he regretted asking for it.",tables_turned,medium,"confident, sharp, satisfying, ironic, feminine, triumphant, poetic",0.93,"{""story_type"": ""tables_turned"", ""realism_level"": ""medium"", ""hooks"": [{""hook_type"": ""shock"", ""energy"": ""high"", ""pattern"": ""I gave my ___ exactly what they asked for, and they instantly regretted it."", ""opening_style"": ""Confident, direct, and slightly ironic with a poetic twist."", ""comment_bait"": ""Viewers love seeing karma delivered and debating if the revenge was justified or realistic.""}, {""hook_type"": ""confession"", ""energy"": ""high"", ""pattern"": ""For months, I collected evidence that ___ was betraying me, but I waited for the perfect moment to strike."", ""opening_style"": ""Calm, composed, and strategic, hinting at a master plan."", ""comment_bait"": ""People are drawn to the intelligence and patience, sparking discussions about how they would handle betrayal.""}, {""hook_type"": ""stakes"", ""energy"": ""medium"", ""pattern"": ""He said he wanted freedom—so I gave it to him, wrapped up with a bow."", ""opening_style"": ""Witty, sharp, and triumphant with a feminine edge."", ""comment_bait"": ""The poetic justice and irony invite comments about getting what you wish for.""}, {""hook_type"": ""mystery"", ""energy"": ""medium"", ""pattern"": ""What do you do when someone you love asks for something that will destroy them?"", ""opening_style"": ""Thoughtful, slightly ominous, and inviting curiosity."", ""comment_bait"": ""Prompts viewers to share their own experiences or opinions about tough choices in relationships.""}, {""hook_type"": ""question"", ""energy"": ""high"", ""pattern"": ""Have you ever handed someone the exact thing they claimed to want, just to watch them crumble?"", ""opening_style"": ""Engaging, direct, and a bit provocative."", ""comment_bait"": ""Encourages people to share personal stories and debate the morality of giving people what they ask for.""}]}"
oddlypeople,https://www.youtube.com/watch?v=ZbLRlML19H0,Whaf's the most heartbreaking secret you've kept from your family?·#funny #reddit #story,family_drama,high,heartbreaking; sentimental; nostalgic; reflective; sincere; loving; gentle; tragic,0.97,"{""story_type"": ""family_drama"", ""realism_level"": ""high"", ""hooks"": [{""hook_type"": ""question"", ""energy"": ""high"", ""pattern"": ""Whats the most heartbreaking secret youve ever kept from your family?"", ""opening_style"": ""Direct, personal, and emotionally charged question to the audience"", ""comment_bait"": ""Invites viewers to share their own secrets and emotional experiences""}, {""hook_type"": ""mystery"", ""energy"": ""high"", ""pattern"": ""Have you ever stumbled on something in your house that changed your life forever?"", ""opening_style"": ""Conversational and suspenseful, setting up a personal discovery"", ""comment_bait"": ""Triggers curiosity and personal stories about life-changing discoveries""}, {""hook_type"": ""confession"", ""energy"": ""medium"", ""pattern"": ""I never told anyone about the day I found out the truth about my mom."", ""opening_style"": ""Intimate, reflective, and sincere first-person confession"", ""comment_bait"": ""Encourages empathy and similar confessions from viewers""}, {""hook_type"": ""stakes"", ""energy"": ""high"", ""pattern"": ""Imagine finding out your parent was hiding something that would change your family forever."", ""opening_style"": ""Hypothetical, inviting the audience to put themselves in the storytellers shoes"", ""comment_bait"": ""Prompts viewers to imagine their own reactions and share thoughts""}, {""hook_type"": ""shock"", ""energy"": ""high"", ""pattern"": ""The day I found my moms secret diary, everything I thought I knew changed."", ""opening_style"": ""Dramatic, immediate, and personal, using a pivotal moment"", ""comment_bait"": ""Draws in viewers with a twist and invites speculation or shared shock""}]}"
glitchtoast67,https://www.youtube.com/watch?v=nVby6zp82S4,"Doctors, what's the FUNNIEST thing a PATIENT has SAID while under ANESTHESIA? 💉🐿️",anesthesia_confessions,low,absurd; witty; chaotic; playful; ironic; lighthearted; surreal; conspiratorial,0.94,"{""story_type"": ""anesthesia_confessions"", ""realism_level"": ""low"", ""hooks"": [{""hook_type"": ""question"", ""energy"": ""high"", ""pattern"": ""Doctors, what is the wildest thing a patient has ever blurted out under anesthesia?"", ""opening_style"": ""Direct address, playful curiosity, sets up absurd expectation"", ""comment_bait"": ""Invites people to share their own stories or react with disbelief""}, {""hook_type"": ""confession"", ""energy"": ""high"", ""pattern"": ""I never expected to hear a patient confess their secret theory about ___ right before surgery."", ""opening_style"": ""First-person, ironic, sets up a twist, conversational"", ""comment_bait"": ""Makes viewers guess or joke about what the theory could be""}, {""hook_type"": ""mystery"", ""energy"": ""high"", ""pattern"": ""You won’t believe what this patient revealed as the anesthesia kicked in."", ""opening_style"": ""Teasing, suspenseful, clickbait phrasing"", ""comment_bait"": ""Drives curiosity and speculation in the comments""}, {""hook_type"": ""stakes"", ""energy"": ""medium"", ""pattern"": ""Right before going under, he grabbed my arm and said he had to warn me about ___."", ""opening_style"": ""Dramatic, conspiratorial, uses dialogue for immediacy"", ""comment_bait"": ""Prompts jokes and memes about what the warning could be""}, {""hook_type"": ""shock"", ""energy"": ""high"", ""pattern"": ""Just as the meds kicked in, he looked me dead in the eye and said ___ like it was life or death."", ""opening_style"": ""Vivid, absurd, builds suspense before punchline"", ""comment_bait"": ""Encourages people to share their own shocking or funny anesthesia moments""}, {""hook_type"": ""confession"", ""energy"": ""medium"", ""pattern"": ""He whispered to me, dead serious, that ___ was about to happen."", ""opening_style"": ""Understated, dry humor, sets up surreal reveal"", ""comment_bait"": ""Invites playful speculation and meme responses""}]}"
householdhavoc,https://www.youtube.com/watch?v=63FIczYUMnM,My Mom K*lled My Daughter 🥺💔 Reddit Stories,family_tragedy,high,"tragedy, empathy, grief, realism, forgiveness, moral-conflict, sorrow, compassion",0.81,"{""story_type"": ""family_tragedy"", ""realism_level"": ""high"", ""hooks"": [{""hook_type"": ""shock"", ""energy"": ""high"", ""pattern"": ""The day my mom was blamed for my child's death changed everything."", ""opening_style"": ""Direct, blunt, emotionally raw statement that reveals the tragedy immediately."", ""comment_bait"": ""Instantly polarizes viewers on blame and responsibility, prompting debate and empathy.""}, {""hook_type"": ""question"", ""energy"": ""high"", ""pattern"": ""Was it truly my mom's fault that my daughter died, or was it just a tragic accident?"", ""opening_style"": ""Reflective, invites audience judgment, sets up moral ambiguity."", ""comment_bait"": ""Invites viewers to weigh in on blame, morality, and accident versus intent.""}, {""hook_type"": ""confession"", ""energy"": ""medium"", ""pattern"": ""I never thought I would have to choose between my wife and my mom after losing my child."", ""opening_style"": ""Personal, vulnerable, sets up impossible emotional stakes."", ""comment_bait"": ""Triggers strong opinions about loyalty, grief, and family dynamics.""}, {""hook_type"": ""stakes"", ""energy"": ""high"", ""pattern"": ""My wife told me she would divorce me if I didn't cut my mom out of our lives after our daughter's death."", ""opening_style"": ""Matter-of-fact, high-stakes ultimatum, immediately sets up conflict."", ""comment_bait"": ""Drives debate over right and wrong, and what viewers would do in this situation.""}, {""hook_type"": ""mystery"", ""energy"": ""medium"", ""pattern"": ""Everyone thinks my mom is to blame for what happened, but the truth is more complicated."", ""opening_style"": ""Intriguing, hints at hidden details, draws viewers in to learn more."", ""comment_bait"": ""Encourages speculation and sharing of personal experiences with blame and accidents.""}]}"
oddlypeople,https://www.youtube.com/watch?v=1tmtCdqcQlI,I Made My Daughter Into A Racist 😒💔 Reddit Stories,parenting_controversy,high,"empathetic, defensive, ironic, indignant, parental, cultural, sincere, empowering",0.87,"{""story_type"": ""parenting_controversy"", ""realism_level"": ""high"", ""hooks"": [{""hook_type"": ""confession"", ""energy"": ""high"", ""pattern"": ""I never thought I’d be accused of ___ just for ___ my own child."", ""opening_style"": ""Direct, personal, and vulnerable with a hint of disbelief."", ""comment_bait"": ""Invites strong opinions and personal stories about unfair accusations.""}, {""hook_type"": ""shock"", ""energy"": ""high"", ""pattern"": ""Someone called me ___ for doing something every parent does."", ""opening_style"": ""Blunt, dramatic, and confrontational."", ""comment_bait"": ""Provokes outrage and debate over what is or isn’t acceptable.""}, {""hook_type"": ""question"", ""energy"": ""medium"", ""pattern"": ""Does caring for your child the right way make you ___?"", ""opening_style"": ""Thoughtful, rhetorical, and slightly defensive."", ""comment_bait"": ""Encourages people to weigh in with their own judgments and experiences.""}, {""hook_type"": ""stakes"", ""energy"": ""medium"", ""pattern"": ""I thought I was being a good parent until someone said I was ___ instead."", ""opening_style"": ""Reflective, empathetic, and self-questioning."", ""comment_bait"": ""Triggers empathy and discussion about parenting standards.""}, {""hook_type"": ""mystery"", ""energy"": ""medium"", ""pattern"": ""What do you do when a friend accuses you of ___ over something as simple as ___?"", ""opening_style"": ""Curious, conversational, and slightly incredulous."", ""comment_bait"": ""Sparks curiosity and invites people to share similar dilemmas.""}, {""hook_type"": ""confession"", ""energy"": ""high"", ""pattern"": ""I was blindsided when someone said I was teaching my child to ___."", ""opening_style"": ""Personal, emotional, and confessional."", ""comment_bait"": ""Draws in viewers who want to defend or challenge the storyteller.""}]}"
householdhavoc,https://www.youtube.com/watch?v=JrGo_z4h_mg,"Teachers, What's the craziest thing a parent has demanded from you?",teacher_vs_parent_showdown,high,"courageous, vindicating, dramatic, inspiring, moral, heartfelt, realistic, empowering",0.91,"{""story_type"": ""teacher_vs_parent_showdown"", ""realism_level"": ""high"", ""hooks"": [{""hook_type"": ""question"", ""energy"": ""high"", ""pattern"": ""Teachers, what is the wildest thing a parent has ever demanded from you?"", ""opening_style"": ""Direct address, conversational, sets up a real-life scenario"", ""comment_bait"": ""Invites viewers to share their own shocking or relatable experiences""}, {""hook_type"": ""shock"", ""energy"": ""high"", ""pattern"": ""I was just weeks into teaching when a parent stormed into my classroom and demanded I rewrite the rules for her child."", ""opening_style"": ""First-person, immediate, dramatic, sets the scene with urgency"", ""comment_bait"": ""Triggers strong opinions about entitlement and boundaries""}, {""hook_type"": ""stakes"", ""energy"": ""high"", ""pattern"": ""Imagine being a new teacher and a parent tries to rewrite your entire curriculum on the spot."", ""opening_style"": ""Imaginative, puts audience in storytellers shoes, raises tension"", ""comment_bait"": ""Makes viewers empathize and debate what they would do""}, {""hook_type"": ""confession"", ""energy"": ""medium"", ""pattern"": ""I never thought my first year teaching would involve standing up to a parent who thought the rules didn’t apply to her."", ""opening_style"": ""Reflective, personal, hints at confrontation and growth"", ""comment_bait"": ""Encourages support and personal stories of standing up for oneself""}, {""hook_type"": ""mystery"", ""energy"": ""medium"", ""pattern"": ""You won’t believe what one parent tried to force me to do for her child right in front of the whole class."", ""opening_style"": ""Teasing, suspenseful, promises a dramatic reveal"", ""comment_bait"": ""Drives curiosity and speculation about the details""}]}"
historyofnothings,https://www.youtube.com/watch?v=Ak4mPBHVgkE,What's the craziest thing you saw a military chaplain do in combat?,legendary_heroics,high,"heroic, reverent, cinematic, inspiring, spiritual, masculine, disciplined, legendary",0.94,"{""story_type"": ""legendary_heroics"", ""realism_level"": ""high"", ""hooks"": [{""hook_type"": ""question"", ""energy"": ""high"", ""pattern"": ""Whats the wildest thing you ever saw a ___ do in ___?"", ""opening_style"": ""Direct, conversational, sets up anticipation for an extraordinary story"", ""comment_bait"": ""Invites people to share their own wild stories or debate the truth of the tale""}, {""hook_type"": ""stakes"", ""energy"": ""high"", ""pattern"": ""Most ___ play it safe, but not ___ — and what happened next became legend."", ""opening_style"": ""Contrasts expectation with a bold exception, cinematic and dramatic"", ""comment_bait"": ""Provokes awe and discussion about breaking rules or going above and beyond""}, {""hook_type"": ""mystery"", ""energy"": ""medium"", ""pattern"": ""Everyone thought ___ would just ___, but nobody expected what ___ did that day."", ""opening_style"": ""Sets up a twist, draws curiosity with understated suspense"", ""comment_bait"": ""Makes viewers guess or speculate before the reveal""}, {""hook_type"": ""shock"", ""energy"": ""high"", ""pattern"": ""The day ___ turned a ___ into ___, everything changed."", ""opening_style"": ""Bold, mythic phrasing, instantly raises stakes and intrigue"", ""comment_bait"": ""Triggers disbelief, awe, and meme-worthy reactions""}, {""hook_type"": ""confession"", ""energy"": ""medium"", ""pattern"": ""I never believed in ___ until I saw ___ do this in ___"", ""opening_style"": ""Personal, reflective, sets up a transformative moment"", ""comment_bait"": ""Encourages emotional responses and personal testimonies""}]}"
oddlypeople,https://www.youtube.com/watch?v=jerYBQT4xJA,How did your military nickname follow you home?,nickname_haunting,high,"humorous, self-aware, nostalgic, relatable, affectionate, witty, disciplined, lighthearted",0.92,"{""story_type"": ""nickname_haunting"", ""realism_level"": ""high"", ""hooks"": [{""hook_type"": ""question"", ""energy"": ""high"", ""pattern"": ""What happens when your old nickname refuses to stay in the past?"", ""opening_style"": ""Conversational direct address sets up intrigue with a personal twist"", ""comment_bait"": ""Invites viewers to share their own stories of nicknames or reputations following them""}, {""hook_type"": ""stakes"", ""energy"": ""high"", ""pattern"": ""When your nickname from the military follows you home and your family starts using it against you what do you do?"", ""opening_style"": ""Playful self-aware sets up a humorous conflict right away"", ""comment_bait"": ""Relatable for anyone with a family nickname or inside joke sparks laughter and personal anecdotes""}, {""hook_type"": ""confession"", ""energy"": ""medium"", ""pattern"": ""I thought I left my embarrassing nickname behind until my wife found out."", ""opening_style"": ""Wry self-deprecating confessional tone that builds curiosity"", ""comment_bait"": ""Makes people want to confess their own similar stories or tease the storyteller""}, {""hook_type"": ""mystery"", ""energy"": ""medium"", ""pattern"": ""Ever wonder how a single nickname can change your whole family dynamic?"", ""opening_style"": ""Reflective slightly nostalgic hints at a bigger story"", ""comment_bait"": ""Gets viewers speculating about the story and sharing their own family nickname experiences""}, {""hook_type"": ""question"", ""energy"": ""high"", ""pattern"": ""How did a harmless military joke turn into my familys favorite running gag?"", ""opening_style"": ""Lighthearted sets up irony draws the audience in with a relatable premise"", ""comment_bait"": ""Encourages viewers to comment with their own running gags or family jokes""}]}"
