most_similar_channel,reference_link,title,story_type,realism_level,tone_keywords,virality_forecast_score,hook_variants_json
householdhavoc,https://www.youtube.com/watch?v=nceV01zQcvs,What's the hilarious thing a kid has said during custody hearing?,family_drama,medium,ironic clever justice fast-paced deadpan witty,0.92,"{""story_type"": ""family_drama"", ""realism_level"": ""medium"", ""hooks"": [{""hook_type"": ""question"", ""energy"": ""high"", ""pattern"": ""What is the wildest thing a kid has ever done in a courtroom"", ""opening_style"": ""Direct punchy and sets up immediate curiosity with a bold question"", ""comment_bait"": ""Invites people to share their own stories or react with disbelief""}, {""hook_type"": ""stakes"", ""energy"": ""high"", ""pattern"": ""How did an eight-year-old end up exposing both parents in front of a judge"", ""opening_style"": ""Sets up high-stakes drama with a twist using fast-paced phrasing"", ""comment_bait"": ""Makes viewers want to guess what happened and debate the outcome""}, {""hook_type"": ""shock"", ""energy"": ""high"", ""pattern"": ""Imagine an eight-year-old walking into court with jars receipts and a PowerPoint what happened next"", ""opening_style"": ""Paints a vivid absurd scene with deadpan delivery and irony"", ""comment_bait"": ""Triggers reactions about the kids boldness and the parents embarrassment""}, {""hook_type"": ""confession"", ""energy"": ""medium"", ""pattern"": ""I never thought Id see a kid roast their parents in court until this happened"", ""opening_style"": ""Clever first-person setup with a hint of disbelief and wit"", ""comment_bait"": ""Encourages people to share similar experiences or express shock""}, {""hook_type"": ""mystery"", ""energy"": ""medium"", ""pattern"": ""What do you do when an eight-year-old brings more evidence than both lawyers combined"", ""opening_style"": ""Wry ironic tone that teases the storys clever twist"", ""comment_bait"": ""Sparks debate about justice parenting and the kids intelligence""}]}"
stupidluckfiles,https://www.youtube.com/watch?v=unknown,an accident in the bathroom || roblox storytime,bathroom_chaos,low,"shock, absurdity, chaos, cringe, irony",0.88,"{""story_type"": ""bathroom_chaos"", ""realism_level"": ""low"", ""hooks"": [{""hook_type"": ""confession"", ""energy"": ""high"", ""pattern"": ""Okay so one time I almost destroyed the bathroom because ___"", ""opening_style"": ""chaotic overshare with meme exaggeration"", ""comment_bait"": ""Invites people to share their own embarrassing or wild stories""}, {""hook_type"": ""shock"", ""energy"": ""high"", ""pattern"": ""I swear I saw ___ out the window when ___ happened"", ""opening_style"": ""absurd, surreal claim delivered deadpan"", ""comment_bait"": ""Triggers people to quote the wildest line and riff with their own absurdities""}, {""hook_type"": ""stakes"", ""energy"": ""high"", ""pattern"": ""I was seconds away from ___ in front of everyone"", ""opening_style"": ""panic-driven, fast-paced urgency"", ""comment_bait"": ""Makes viewers recall their own close calls or cringe moments""}, {""hook_type"": ""confession"", ""energy"": ""medium"", ""pattern"": ""Not gonna lie, I think I broke the universe when ___"", ""opening_style"": ""ironic, self-aware exaggeration"", ""comment_bait"": ""Encourages playful one-upmanship and meme responses""}, {""hook_type"": ""mystery"", ""energy"": ""medium"", ""pattern"": ""You ever wonder what happens when ___ goes horribly wrong?"", ""opening_style"": ""conversational, draws in curiosity"", ""comment_bait"": ""Prompts people to answer with their own theories or stories""}, {""hook_type"": ""shock"", ""energy"": ""high"", ""pattern"": ""The fire alarm went off and everyone thought ___"", ""opening_style"": ""chaotic escalation, blending reality with absurdity"", ""comment_bait"": ""Gets people quoting the line and escalating the chaos in comments""}]}"
empathhero,https://www.youtube.com/watch?v=UrM6vz0AXl4,It's so sad to hear a story like this 😭,tables_turned,high,"empathy, nostalgia, regret, warmth",0.81,"{""story_type"": ""tables_turned"", ""realism_level"": ""high"", ""hooks"": [{""hook_type"": ""mystery"", ""energy"": ""high"", ""pattern"": ""Everyone warned us to stay away from ___, but one day we found out the truth."", ""opening_style"": ""Direct, suspenseful, sets up a twist with a sense of foreboding."", ""comment_bait"": ""Invites people to share similar stories of misunderstood people or situations.""}, {""hook_type"": ""confession"", ""energy"": ""medium"", ""pattern"": ""I used to believe all the scary stories about ___ until something changed everything."", ""opening_style"": ""Reflective, personal, draws in with vulnerability."", ""comment_bait"": ""Encourages confessions about judging too soon or changing perspectives.""}, {""hook_type"": ""question"", ""energy"": ""high"", ""pattern"": ""Have you ever realized someone everyone feared was just lonely?"", ""opening_style"": ""Conversational, empathetic, immediately relatable."", ""comment_bait"": ""Prompts viewers to answer with their own experiences or feelings.""}, {""hook_type"": ""stakes"", ""energy"": ""medium"", ""pattern"": ""We were terrified to knock on that door, but what happened next changed us forever."", ""opening_style"": ""Storytelling, nostalgic, hints at a pivotal moment."", ""comment_bait"": ""Builds anticipation and encourages sharing of similar pivotal childhood moments.""}, {""hook_type"": ""shock"", ""energy"": ""high"", ""pattern"": ""The person everyone called dangerous turned out to be the kindest soul I ever met."", ""opening_style"": ""Surprising, emotional, flips expectations immediately."", ""comment_bait"": ""Triggers emotional reactions and stories about misjudged people.""}]}"
householdhavoc,https://youtube.com/shorts/example,My Mom Thinks My Daughter Is Too Boyish 🥺💔 Reddit Stories,family_drama,high,"boundaries, frustration, empowerment, maternal love, defiance",0.86,"{""story_type"": ""family_drama"", ""realism_level"": ""high"", ""hooks"": [{""hook_type"": ""shock"", ""energy"": ""high"", ""pattern"": ""My family did ___ to my child without telling me, and that was the last straw."", ""opening_style"": ""Direct, emotional, and immediately revealing the conflict."", ""comment_bait"": ""People react to the audacity and debate boundaries versus family involvement.""}, {""hook_type"": ""stakes"", ""energy"": ""high"", ""pattern"": ""When does caring cross the line into control? I found out the hard way."", ""opening_style"": ""Reflective, provocative, and sets up a moral dilemma."", ""comment_bait"": ""Invites debate about parenting, control, and family roles.""}, {""hook_type"": ""confession"", ""energy"": ""medium"", ""pattern"": ""I never thought I’d have to protect my child from my own family."", ""opening_style"": ""Personal, vulnerable, and confessional tone."", ""comment_bait"": ""Encourages empathy and sharing of similar experiences.""}, {""hook_type"": ""question"", ""energy"": ""medium"", ""pattern"": ""Would you let your family decide what’s best for your kid?"", ""opening_style"": ""Conversational, directly addresses the audience."", ""comment_bait"": ""Sparks opinions and personal stories in the comments.""}, {""hook_type"": ""mystery"", ""energy"": ""medium"", ""pattern"": ""It started with snacks, but ended with my daughter in tears—here’s what happened."", ""opening_style"": ""Storyteller, hints at escalation and emotional stakes."", ""comment_bait"": ""Builds curiosity and invites people to guess or relate.""}]}"
wrongnumberfiles,https://youtube.com/shorts/example3,Have you ever been recruited as an alibi for someone you just met?,stranger_deception,medium,"chaotic, absurdity, quick-wit, deception, irony",0.88,"{""story_type"": ""stranger_deception"", ""realism_level"": ""medium"", ""hooks"": [{""hook_type"": ""question"", ""energy"": ""high"", ""pattern"": ""Have you ever been pulled into a strangers lie before you even knew their name?"", ""opening_style"": ""Direct address, conversational, sets up chaos instantly"", ""comment_bait"": ""Invites people to share their own wild or awkward encounters""}, {""hook_type"": ""confession"", ""energy"": ""high"", ""pattern"": ""I never thought Id end up pretending to be someones partner just to help them out of a mess."", ""opening_style"": ""First-person, self-aware, hints at absurdity to come"", ""comment_bait"": ""Makes viewers admit what they would do or if theyd play along""}, {""hook_type"": ""shock"", ""energy"": ""high"", ""pattern"": ""One second I was sipping coffee, the next I was someones fake alibi."", ""opening_style"": ""Fast-paced, abrupt transition, emphasizes sudden chaos"", ""comment_bait"": ""Gets people to react to the sudden escalation and share disbelief""}, {""hook_type"": ""stakes"", ""energy"": ""medium"", ""pattern"": ""What would you do if a stranger begged you to save them from their exon the spot?"", ""opening_style"": ""Hypothetical, puts audience in the hot seat, playful challenge"", ""comment_bait"": ""Prompts debate about whats right, wrong, or possible in that situation""}, {""hook_type"": ""mystery"", ""energy"": ""medium"", ""pattern"": ""It all started when a woman sat down and whispered Just go with it."", ""opening_style"": ""Intriguing, cinematic, sets up suspense with minimal context"", ""comment_bait"": ""Makes people curious about what happens next and speculate""}]}"
dreamlogic67,https://youtube.com/shorts/example4,I once escaped a mental hospital.,escape_thriller,high,"isolation, fear, defiance, urgency, confinement",0.81,"{""story_type"": ""escape_thriller"", ""realism_level"": ""high"", ""hooks"": [{""hook_type"": ""confession"", ""energy"": ""high"", ""pattern"": ""I once escaped from ___ and no one believed I could."", ""opening_style"": ""Direct, first-person, immediately revealing the shocking act."", ""comment_bait"": ""Invites disbelief and demands for details, prompting people to question or share similar stories.""}, {""hook_type"": ""shock"", ""energy"": ""high"", ""pattern"": ""They locked me in ___, but I found a way out."", ""opening_style"": ""Matter-of-fact, blunt statement of extreme situation and defiance."", ""comment_bait"": ""Shocks viewers with the premise, leading to debates about the situation and system.""}, {""hook_type"": ""stakes"", ""energy"": ""high"", ""pattern"": ""If I didn’t escape from ___, I don’t know what would have happened."", ""opening_style"": ""Urgent, personal, hints at danger and desperation."", ""comment_bait"": ""Raises immediate questions about motivation and consequences, sparking speculation.""}, {""hook_type"": ""mystery"", ""energy"": ""medium"", ""pattern"": ""Ever wonder what it takes to break out of ___? Here’s how I did it."", ""opening_style"": ""Conversational, invites curiosity, sets up a how-did-it-happen story."", ""comment_bait"": ""Encourages people to guess or share what they think happened, fueling engagement.""}, {""hook_type"": ""question"", ""energy"": ""medium"", ""pattern"": ""What would you do if you were trapped in ___ with no way out?"", ""opening_style"": ""Directly addresses the viewer, puts them in the storyteller's shoes."", ""comment_bait"": ""Prompts viewers to imagine themselves in the situation, leading to empathy or debate.""}, {""hook_type"": ""confession"", ""energy"": ""high"", ""pattern"": ""I shouldn’t tell you this, but I escaped from ___ and here’s what happened."", ""opening_style"": ""Secretive, confessional, draws in the audience with forbidden knowledge."", ""comment_bait"": ""Makes people want to know the forbidden details and share their reactions.""}]}"
stupidluckfiles,https://www.youtube.com/watch?v=87KbKMy_nWw,When did the class clown go way too far?,reckless_dare_gone_wrong,medium,"chaos, shock, stupidity, irony, recklessness",0.83,"{""story_type"": ""reckless_dare_gone_wrong"", ""realism_level"": ""medium"", ""hooks"": [{""hook_type"": ""question"", ""energy"": ""high"", ""pattern"": ""When did someone go so far for attention that it actually shocked everyone?"", ""opening_style"": ""Direct, conversational, sets up chaos and disbelief"", ""comment_bait"": ""Invites people to share or debate outrageous moments and compare stories""}, {""hook_type"": ""shock"", ""energy"": ""high"", ""pattern"": ""I watched someone do the dumbest thing ever just to make us laugh—and it almost ended in disaster."", ""opening_style"": ""First-person, blunt, sets up absurdity and stakes immediately"", ""comment_bait"": ""Makes viewers react with disbelief or share similar reckless stories""}, {""hook_type"": ""confession"", ""energy"": ""medium"", ""pattern"": ""I never thought I’d see someone actually try this in class, but then it happened."", ""opening_style"": ""Reflective, slightly ironic, hints at regret and shock"", ""comment_bait"": ""Triggers people to comment on what they think happened or share their own school chaos""}, {""hook_type"": ""stakes"", ""energy"": ""high"", ""pattern"": ""This is the story of the day a joke in class went way too far—and nobody was laughing by the end."", ""opening_style"": ""Narrative, suspenseful, foreshadows consequences"", ""comment_bait"": ""Drives curiosity about the outcome and invites debate on boundaries""}, {""hook_type"": ""mystery"", ""energy"": ""medium"", ""pattern"": ""It started as just another prank, but what happened next had the whole class in shock."", ""opening_style"": ""Teasing, sets up a twist, uses suspenseful phrasing"", ""comment_bait"": ""Gets people speculating about what could possibly happen""}]}"
stupidluckfiles,https://www.youtube.com/watch?v=8EoI4uguQYg,Who's the dumbest criminal you've ever seen?,pet_hero,high,"heroism, irony, chaos, poetic justice, surprise",0.92,"{""story_type"": ""pet_hero"", ""realism_level"": ""high"", ""hooks"": [{""hook_type"": ""question"", ""energy"": ""high"", ""pattern"": ""Who is the most clueless criminal you have ever heard of"", ""opening_style"": ""Direct, conversational, invites audience to share their own stories"", ""comment_bait"": ""Prompts people to tell their own wild or funny crime stories""}, {""hook_type"": ""confession"", ""energy"": ""medium"", ""pattern"": ""I begged for a pet for years, but nothing prepared me for what happened next"", ""opening_style"": ""Personal, relatable, sets up irony and surprise"", ""comment_bait"": ""Encourages people to share their own pet stories or regrets""}, {""hook_type"": ""stakes"", ""energy"": ""high"", ""pattern"": ""I thought getting a dog would keep my family safe until chaos broke loose"", ""opening_style"": ""Dramatic, suspenseful, hints at unexpected twists"", ""comment_bait"": ""Invites debate about pets as protectors and stories of unexpected heroism""}, {""hook_type"": ""shock"", ""energy"": ""high"", ""pattern"": ""One morning I came home to find the front door wide open and my heart dropped"", ""opening_style"": ""Immediate, tense, drops viewer into the action"", ""comment_bait"": ""Triggers people to share similar scary or shocking moments""}, {""hook_type"": ""mystery"", ""energy"": ""medium"", ""pattern"": ""Everything seemed normal until my dog did something no one expected"", ""opening_style"": ""Teasing, builds curiosity, sets up a twist"", ""comment_bait"": ""Makes viewers guess what happened next or share their own plot twists""}]}"
historyofnothings,https://www.youtube.com/watch?v=bwba1fdEJzg,What was the moment you lost all respect for a teacher?,teacher_exposed,medium,"satire, absurdity, disbelief, humor, irony",0.97,"{""story_type"": ""teacher_exposed"", ""realism_level"": ""medium"", ""hooks"": [{""hook_type"": ""question"", ""energy"": ""high"", ""pattern"": ""What was the moment you realized your teacher was just making stuff up?"", ""opening_style"": ""direct, conversational, invites personal reflection"", ""comment_bait"": ""People want to share their own stories of teachers caught lying or exaggerating""}, {""hook_type"": ""shock"", ""energy"": ""high"", ""pattern"": ""Ever caught a teacher telling a story so wild you had to Google it on the spot?"", ""opening_style"": ""casual, incredulous, sets up disbelief"", ""comment_bait"": ""Viewers jump in with their own unbelievable classroom moments""}, {""hook_type"": ""confession"", ""energy"": ""medium"", ""pattern"": ""I lost all respect for my teacher the day he claimed ___ and expected us to believe it."", ""opening_style"": ""personal, confessional, slightly dramatic"", ""comment_bait"": ""Invites others to confess their own moments of disbelief""}, {""hook_type"": ""question"", ""energy"": ""medium"", ""pattern"": ""Have you ever heard a teacher say something so absurd it became a meme?"", ""opening_style"": ""light, meme-aware, playful"", ""comment_bait"": ""Prompts meme sharing and inside jokes in the comments""}, {""hook_type"": ""mystery"", ""energy"": ""high"", ""pattern"": ""Why did my teacher insist that ___ happened, even when everyone knew it was impossible?"", ""opening_style"": ""curious, slightly dramatic, sets up irony"", ""comment_bait"": ""Encourages debate and speculation about teacher motives""}]}"
karmafables,https://www.youtube.com/watch?v=5nSCQLl2_HM,What’s your best “The tables have turned” moment?,tables_turned,high,"karma, irony, justice, reversal, poetic, satisfying",0.93,"{""story_type"": ""tables_turned"", ""realism_level"": ""high"", ""hooks"": [{""hook_type"": ""question"", ""energy"": ""high"", ""pattern"": ""What is your most satisfying tables have turned moment?"", ""opening_style"": ""Direct, conversational, invites audience to share their own stories"", ""comment_bait"": ""Encourages viewers to tell their own reversal stories and compare experiences""}, {""hook_type"": ""shock"", ""energy"": ""high"", ""pattern"": ""Imagine the person who tried to ruin your life ends up working for you years later."", ""opening_style"": ""Bold, dramatic, sets up irony and reversal immediately"", ""comment_bait"": ""Triggers reactions about karma, poetic justice, and personal revenge fantasies""}, {""hook_type"": ""mystery"", ""energy"": ""medium"", ""pattern"": ""Ever wondered what happens to the people who wronged you after school?"", ""opening_style"": ""Reflective, slightly suspenseful, invites curiosity"", ""comment_bait"": ""Prompts speculation and personal anecdotes about old enemies""}, {""hook_type"": ""stakes"", ""energy"": ""medium"", ""pattern"": ""She said I would never make it, but ten years later, guess who showed up at my door?"", ""opening_style"": ""Teasing, builds anticipation, uses a cliffhanger"", ""comment_bait"": ""Makes viewers guess the twist and share their own full-circle moments""}, {""hook_type"": ""confession"", ""energy"": ""medium"", ""pattern"": ""I never thought I’d see her again, let alone in my own house."", ""opening_style"": ""Personal, intimate, draws audience into the narrators shock"", ""comment_bait"": ""Invites empathy and discussion about unexpected reunions""}]}"
empathhero,https://www.youtube.com/watch?v=SqH9LbYfChI,Have you ever accidentally saved a life?,unexpected_impact,high,"empathy, kindness, fate, redemption, emotional, uplifting",0.91,"{""story_type"": ""unexpected_impact"", ""realism_level"": ""high"", ""hooks"": [{""hook_type"": ""question"", ""energy"": ""high"", ""pattern"": ""Have you ever realized you changed someones life without even knowing it"", ""opening_style"": ""Direct, conversational, invites the viewer to reflect personally"", ""comment_bait"": ""Prompts viewers to share their own stories or moments of unexpected impact""}, {""hook_type"": ""confession"", ""energy"": ""medium"", ""pattern"": ""I had no idea a small act of kindness would completely change everything."", ""opening_style"": ""Honest, humble, sets up a surprising twist"", ""comment_bait"": ""Encourages empathy and sharing of similar experiences""}, {""hook_type"": ""shock"", ""energy"": ""high"", ""pattern"": ""I accidentally saved a life, and I didnt even realize it until years later."", ""opening_style"": ""Matter-of-fact, grabs attention with a bold claim"", ""comment_bait"": ""Drives curiosity and emotional reactions, leading to comments""}, {""hook_type"": ""stakes"", ""energy"": ""high"", ""pattern"": ""What if the smallest thing you did was the reason someone is still here today"", ""opening_style"": ""Thought-provoking, uses hypothetical to raise stakes"", ""comment_bait"": ""Invites viewers to consider the unseen impact of their actions""}, {""hook_type"": ""mystery"", ""energy"": ""medium"", ""pattern"": ""There is something I did in high school that Ill never forgetand neither will he."", ""opening_style"": ""Intriguing, hints at a deeper story, uses suspense"", ""comment_bait"": ""Makes people want to know more and speculate in the comments""}]}"
oddlypeople,https://www.youtube.com/watch?v=2Ppd7CimCP4,WOW THE PLOT TWIST IS INSANE!!😳🤯😱 POOR MOM #shorts #viralshorts #viralvideo #storytime,ethical_horror,medium,outrage disbelief ethical-horror grief betrayal investigative somber,0.35,"{""story_type"": ""ethical_horror"", ""realism_level"": ""medium"", ""hooks"": [{""hook_type"": ""shock"", ""energy"": ""high"", ""pattern"": ""We thought losing her was the worst part—until we found out who took her heart."", ""opening_style"": ""Direct, abrupt, and emotionally charged with a sense of betrayal."", ""comment_bait"": ""Instant outrage and disbelief, prompting people to question the ethics and demand justice.""}, {""hook_type"": ""mystery"", ""energy"": ""high"", ""pattern"": ""Something felt off after the accident, but nothing prepared us for the truth about her donor."", ""opening_style"": ""Suspenseful, slow reveal, hinting at a hidden twist."", ""comment_bait"": ""Invites speculation and theories, encouraging viewers to guess the twist.""}, {""hook_type"": ""confession"", ""energy"": ""medium"", ""pattern"": ""I never imagined the EMT who arrived that night would change everything for my family."", ""opening_style"": ""Personal, reflective, with a hint of dread."", ""comment_bait"": ""Makes viewers want to know more and share their own opinions or experiences.""}, {""hook_type"": ""stakes"", ""energy"": ""high"", ""pattern"": ""When the hospital called us, we had no idea our grief was just beginning."", ""opening_style"": ""Somber, foreboding, sets up escalating tragedy."", ""comment_bait"": ""Triggers empathy and debate about hospital practices and ethics.""}, {""hook_type"": ""question"", ""energy"": ""high"", ""pattern"": ""What would you do if you learned the person meant to save your loved one had other plans?"", ""opening_style"": ""Provocative, direct address to the audience, invites moral judgment."", ""comment_bait"": ""Drives moral debate and personal stories in the comments.""}]}"
stupidluckfiles,https://www.youtube.com/watch?v=0m-SbtqfBk0,"I went to the Minecraft movie, and left in an ambulance.",fandom_chaos,low,absurdity chaos disbelief injury humor meme hysteria,0.92,"{""story_type"": ""fandom_chaos"", ""realism_level"": ""low"", ""hooks"": [{""hook_type"": ""shock"", ""energy"": ""high"", ""pattern"": ""I went to ___ expecting fun, but ended up leaving in an ambulance."", ""opening_style"": ""Deadpan delivery with immediate escalation, blending disbelief and humor."", ""comment_bait"": ""Sets up an absurd twist that invites disbelief, jokes, and meme responses.""}, {""hook_type"": ""confession"", ""energy"": ""high"", ""pattern"": ""My friends told me ___ would be wild, but I had no idea what was coming."", ""opening_style"": ""Conversational, self-deprecating, and foreshadowing chaos."", ""comment_bait"": ""Relatable setup for people to share similar peer-pressure or wild event stories.""}, {""hook_type"": ""mystery"", ""energy"": ""medium"", ""pattern"": ""I thought ___ was just another event, but then everything went off the rails."", ""opening_style"": ""Calm build-up with a sudden hint of impending absurdity."", ""comment_bait"": ""Invites speculation and curiosity about what could possibly go wrong.""}, {""hook_type"": ""stakes"", ""energy"": ""high"", ""pattern"": ""If you think ___ fandoms are intense, wait until you hear what happened to me."", ""opening_style"": ""Challenging, direct address to the audience, invoking internet culture."", ""comment_bait"": ""Provokes fandom rivalry and meme commentary.""}, {""hook_type"": ""question"", ""energy"": ""medium"", ""pattern"": ""Have you ever been to ___ where things got so out of hand you needed medical attention?"", ""opening_style"": ""Engaging, inviting audience participation with a wild premise."", ""comment_bait"": ""Encourages people to share their own chaotic or unbelievable event stories.""}, {""hook_type"": ""shock"", ""energy"": ""high"", ""pattern"": ""Nothing could have prepared me for what happened during ___."", ""opening_style"": ""Dramatic understatement, building suspense with a hint of absurdity."", ""comment_bait"": ""Drives curiosity and disbelief, prompting people to react or call out exaggeration.""}]}"
